No.,Time,Source,Destination,Protocol,Length,Info
1,0,203.242.85.196,189.93.30.233,ICMP,60,"Echo (ping) request  id=0xea27, seq=3213/36108, ttl=61 (no response found!)"
2,0.000007,210.209.29.72,203.242.64.23,TCP,1514,443  >  57658 [ACK] Seq=1 Ack=1 Win=245 Len=1460
3,0.000007,108.177.52.154,133.251.186.6,TCP,74,51779  >  23 [SYN] Seq=0 Win=14600 Len=0 MSS=1460 SACK_PERM TSval=866875475 TSecr=0 WS=128
4,0.000018,60.181.32.144,203.242.66.199,TCP,1468,63875  >  35089 [ACK] Seq=1 Ack=1 Win=1025 Len=1414
5,0.00003,60.181.32.144,203.242.66.199,TCP,1468,63875  >  35089 [ACK] Seq=1415 Ack=1 Win=1025 Len=1414
6,0.000046,60.181.32.144,203.242.66.199,TCP,1468,63875  >  35089 [ACK] Seq=2829 Ack=1 Win=1025 Len=1414
7,0.00006,60.181.32.144,203.242.66.199,TCP,1468,63875  >  35089 [ACK] Seq=4243 Ack=1 Win=1025 Len=1414
8,0.000065,202.235.195.33,13.148.76.84,TCP,1502,51787  >  443 [ACK] Seq=1 Ack=1 Win=657 Len=1448
9,0.000104,23.191.255.233,202.235.195.144,TCP,1514,443  >  61038 [ACK] Seq=1 Ack=1 Win=1392 Len=1448 TSval=1581989533 TSecr=4214194534
10,0.000105,203.242.68.75,70.220.177.250,TCP,1506,80  >  54848 [ACK] Seq=1 Ack=1 Win=480 Len=1440 TSval=2173660010 TSecr=1344496330
11,0.000109,202.235.195.33,13.148.76.84,TCP,1494,51787  >  443 [ACK] Seq=1449 Ack=1 Win=657 Len=1440
12,0.000112,23.191.255.233,202.235.195.144,TCP,1514,443  >  61038 [ACK] Seq=1449 Ack=1 Win=1392 Len=1448 TSval=1581989533 TSecr=4214194534
13,0.000112,203.242.68.75,70.220.177.250,TCP,1506,80  >  54848 [ACK] Seq=1441 Ack=1 Win=480 Len=1440 TSval=2173660010 TSecr=1344496330
14,0.000123,185.148.48.141,133.251.129.214,TCP,54,51942  >  62275 [SYN] Seq=0 Win=1024 Len=0
15,0.000124,23.191.255.233,202.235.195.144,TCP,1514,443  >  61038 [ACK] Seq=2897 Ack=1 Win=1392 Len=1448 TSval=1581989533 TSecr=4214194534
16,0.000125,202.235.195.33,13.148.76.84,TCP,1494,51787  >  443 [ACK] Seq=2889 Ack=1 Win=657 Len=1440
17,0.000127,2a01:5d98:c739:8df7:2802:f074:109:7c,2001:7e7d:6f9:db6c:afff:800f:7f46:752,DNS,478,Standard query response 0xe899[Packet size limited during capture]
18,0.000128,3.131.145.67,163.171.1.125,TCP,66,443  >  62026 [ACK] Seq=1 Ack=1 Win=16359 Len=0 TSval=1631208083 TSecr=851307124
19,0.000129,126.187.209.52,203.242.68.95,TCP,54,50022  >  5058 [ACK] Seq=1 Ack=1 Win=26723 Len=0
20,0.000138,202.235.195.33,13.148.76.84,TCP,1518,51787  >  443 [ACK] Seq=4329 Ack=1 Win=657 Len=1464
21,0.000152,126.187.209.52,203.242.68.95,TCP,54,50022  >  5058 [ACK] Seq=1 Ack=2825 Win=26723 Len=0
22,0.000161,202.235.195.33,13.148.76.84,TCP,1502,51787  >  443 [ACK] Seq=5793 Ack=1 Win=657 Len=1448
23,0.000204,202.229.94.149,84.205.131.85,TCP,66,58612  >  22 [ACK] Seq=1 Ack=1 Win=229 Len=0 TSval=2109278887 TSecr=3835132838
24,0.000207,143.202.172.228,202.235.195.6,TCP,1514,443  >  35728 [ACK] Seq=1 Ack=1 Win=122 Len=1448 TSval=737270414 TSecr=853738
25,0.000219,221.182.118.8,203.242.85.196,ICMP,60,"Echo (ping) reply    id=0xda27, seq=5247/32532, ttl=116"
26,0.00022,203.242.85.196,77.143.115.114,ICMP,60,"Echo (ping) request  id=0xdf27, seq=4476/31761, ttl=61 (no response found!)"
27,0.000222,143.202.172.228,202.235.195.6,TCP,1514,443  >  35728 [ACK] Seq=1449 Ack=1 Win=122 Len=1448 TSval=737270414 TSecr=853738
28,0.000231,23.7.149.251,202.235.195.6,TCP,1514,443  >  49326 [ACK] Seq=1 Ack=1 Win=243 Len=1448 TSval=719591752 TSecr=658895000
29,0.000238,203.242.85.196,86.179.232.221,ICMP,60,"Echo (ping) request  id=0xdf27, seq=4476/31761, ttl=61 (no response found!)"
30,0.000239,203.242.85.196,178.64.180.169,ICMP,60,"Echo (ping) request  id=0xef27, seq=1569/8454, ttl=61 (no response found!)"
31,0.000245,23.7.149.251,202.235.195.6,TCP,1514,443  >  49326 [ACK] Seq=1449 Ack=1 Win=243 Len=1448 TSval=719591752 TSecr=658895000
32,0.000246,3.131.145.67,163.171.1.125,TCP,66,443  >  62026 [ACK] Seq=1 Ack=2749 Win=16375 Len=0 TSval=1631208083 TSecr=851307124
33,0.000256,173.66.45.212,202.235.195.6,TCP,1462,443  >  55429 [ACK] Seq=1 Ack=1 Win=398 Len=1396 TSval=1372761024 TSecr=877514879
34,0.00026,203.242.85.196,46.205.23.55,ICMP,60,"Echo (ping) request  id=0xdf27, seq=4476/31761, ttl=61 (no response found!)"
35,0.000268,173.66.45.212,202.235.195.6,TCP,1462,443  >  55429 [ACK] Seq=1397 Ack=1 Win=398 Len=1396 TSval=1372761024 TSecr=877514879
36,0.000274,203.242.85.196,65.87.247.239,ICMP,60,"Echo (ping) request  id=0xdf27, seq=4476/31761, ttl=61 (no response found!)"
37,0.000282,23.191.254.251,202.235.195.6,TCP,1514,80  >  50820 [ACK] Seq=1 Ack=1 Win=235 Len=1448 TSval=1640412654 TSecr=575789884
38,0.000282,203.242.66.199,60.181.32.144,TCP,54,35089  >  63875 [ACK] Seq=1 Ack=4243 Win=15308 Len=0
39,0.000293,23.191.254.251,202.235.195.6,TCP,1514,80  >  50820 [ACK] Seq=1449 Ack=1 Win=235 Len=1448 TSval=1640412654 TSecr=575789884
40,0.00031,23.191.254.251,202.235.195.6,TCP,1514,80  >  50820 [ACK] Seq=2897 Ack=1 Win=235 Len=1448 TSval=1640412654 TSecr=575789884
41,0.000318,23.191.254.251,202.235.195.6,TCP,1514,80  >  50820 [ACK] Seq=4345 Ack=1 Win=235 Len=1448 TSval=1640412654 TSecr=575789884
42,0.000322,203.242.72.219,85.135.218.112,TCP,66,22  >  35550 [ACK] Seq=1 Ack=1 Win=123 Len=0 TSval=1518048785 TSecr=1844190284
43,0.00033,23.191.254.251,202.235.195.6,TCP,1514,80  >  50820 [ACK] Seq=5793 Ack=1 Win=235 Len=1448 TSval=1640412654 TSecr=575789884
44,0.000346,23.191.254.251,202.235.195.6,TCP,1514,80  >  50820 [ACK] Seq=7241 Ack=1 Win=235 Len=1448 TSval=1640412654 TSecr=575789884
45,0.000354,92.137.106.156,203.242.4.33,TCP,54,44771  >  35901 [SYN] Seq=0 Win=1024 Len=0
46,0.000355,23.191.254.251,202.235.195.6,TCP,1514,80  >  50820 [ACK] Seq=8689 Ack=1 Win=235 Len=1448 TSval=1640412654 TSecr=575789884
47,0.000368,23.191.254.251,202.235.195.6,TCP,1514,80  >  50820 [ACK] Seq=10137 Ack=1 Win=235 Len=1448 TSval=1640412654 TSecr=575789884
48,0.00038,23.191.254.251,202.235.195.6,TCP,1514,80  >  50820 [ACK] Seq=11585 Ack=1 Win=235 Len=1448 TSval=1640412654 TSecr=575789884
49,0.000394,23.191.254.251,202.235.195.6,TCP,1514,80  >  50820 [ACK] Seq=13033 Ack=1 Win=235 Len=1448 TSval=1640412654 TSecr=575789884
50,0.000404,23.191.254.251,202.235.195.6,TCP,1514,80  >  50820 [ACK] Seq=14481 Ack=1 Win=235 Len=1448 TSval=1640412654 TSecr=575789884
51,0.000423,202.235.195.33,13.148.76.84,TCP,1494,51787  >  443 [ACK] Seq=7241 Ack=1 Win=657 Len=1440
52,0.000423,23.191.254.251,202.235.195.6,TCP,1514,80  >  50820 [ACK] Seq=15929 Ack=1 Win=235 Len=1448 TSval=1640412654 TSecr=575789884
53,0.00043,23.191.254.251,202.235.195.6,TCP,1514,80  >  50820 [ACK] Seq=17377 Ack=1 Win=235 Len=1448 TSval=1640412654 TSecr=575789884
54,0.000435,202.235.195.33,13.148.76.84,TCP,1494,51787  >  443 [ACK] Seq=8681 Ack=1 Win=657 Len=1440
55,0.000442,23.191.254.251,202.235.195.6,TCP,1514,80  >  50820 [ACK] Seq=18825 Ack=1 Win=235 Len=1448 TSval=1640412654 TSecr=575789884
56,0.000448,202.235.195.33,13.148.76.84,TCP,1494,51787  >  443 [ACK] Seq=10121 Ack=1 Win=657 Len=1440
57,0.000454,23.191.254.251,202.235.195.6,TCP,1514,80  >  50820 [ACK] Seq=20273 Ack=1 Win=235 Len=1448 TSval=1640412654 TSecr=575789884
58,0.000462,202.235.195.33,13.148.76.84,TCP,1494,51787  >  443 [ACK] Seq=11561 Ack=1 Win=657 Len=1440
59,0.000464,203.242.68.95,126.187.209.52,TCP,1466,5058  >  50022 [ACK] Seq=107313 Ack=1 Win=1452 Len=1412
60,0.000465,203.242.72.219,85.135.218.112,TCP,130,"22  >  35550 [PSH, ACK] Seq=1 Ack=1 Win=123 Len=64 TSval=1518048785 TSecr=1844190284"
61,0.000467,23.191.254.251,202.235.195.6,TCP,1514,80  >  50820 [ACK] Seq=21721 Ack=1 Win=235 Len=1448 TSval=1640412654 TSecr=575789884
62,0.000471,202.235.195.33,13.148.76.84,TCP,1494,51787  >  443 [ACK] Seq=13001 Ack=1 Win=657 Len=1440
63,0.000478,23.191.254.251,202.235.195.6,TCP,1514,80  >  50820 [ACK] Seq=23169 Ack=1 Win=235 Len=1448 TSval=1640412654 TSecr=575789884
64,0.000482,203.242.68.95,126.187.209.52,TCP,1466,5058  >  50022 [ACK] Seq=108725 Ack=1 Win=1452 Len=1412
65,0.000484,202.235.195.33,13.148.76.84,TCP,1494,51787  >  443 [ACK] Seq=14441 Ack=1 Win=657 Len=1440
66,0.000491,23.191.254.251,202.235.195.6,TCP,1514,80  >  50820 [ACK] Seq=24617 Ack=1 Win=235 Len=1448 TSval=1640412654 TSecr=575789884
67,0.000496,202.235.195.33,13.148.76.84,TCP,1550,51787  >  443 [ACK] Seq=15881 Ack=1 Win=657 Len=1496
68,0.000502,23.191.254.251,202.235.195.6,TCP,1514,80  >  50820 [ACK] Seq=26065 Ack=1 Win=235 Len=1448 TSval=1640412654 TSecr=575789884
69,0.000512,203.242.68.95,126.187.209.52,TCP,1466,5058  >  50022 [ACK] Seq=110137 Ack=1 Win=1452 Len=1412
70,0.000515,23.191.254.251,202.235.195.6,TCP,1514,80  >  50820 [ACK] Seq=27513 Ack=1 Win=235 Len=1448 TSval=1640412654 TSecr=575789884
71,0.000528,23.191.254.251,202.235.195.6,TCP,1514,80  >  50820 [ACK] Seq=28961 Ack=1 Win=235 Len=1448 TSval=1640412654 TSecr=575789884
72,0.00053,203.242.68.95,126.187.209.52,TCP,1466,5058  >  50022 [ACK] Seq=111549 Ack=1 Win=1452 Len=1412
73,0.000541,23.191.254.251,202.235.195.6,TCP,1514,80  >  50820 [ACK] Seq=30409 Ack=1 Win=235 Len=1448 TSval=1640412654 TSecr=575789884
74,0.000541,202.235.195.33,13.148.76.84,TCP,1494,51787  >  443 [ACK] Seq=17377 Ack=1 Win=657 Len=1440
75,0.00055,202.235.195.33,13.148.76.84,TCP,1494,51787  >  443 [ACK] Seq=18817 Ack=1 Win=657 Len=1440
76,0.000552,23.191.254.251,202.235.195.6,TCP,1514,80  >  50820 [ACK] Seq=31857 Ack=1 Win=235 Len=1448 TSval=1640412654 TSecr=575789884
77,0.000556,203.242.68.95,126.187.209.52,TCP,1466,5058  >  50022 [ACK] Seq=112961 Ack=1 Win=1452 Len=1412
78,0.000563,202.235.195.33,13.148.76.84,TCP,1494,51787  >  443 [ACK] Seq=20257 Ack=1 Win=657 Len=1440
79,0.000564,23.191.254.251,202.235.195.6,TCP,1514,80  >  50820 [ACK] Seq=33305 Ack=1 Win=235 Len=1448 TSval=1640412654 TSecr=575789884
80,0.000582,202.235.195.33,13.148.76.84,TCP,1494,51787  >  443 [ACK] Seq=21697 Ack=1 Win=657 Len=1440
81,0.000582,23.191.254.251,202.235.195.6,TCP,1514,80  >  50820 [ACK] Seq=34753 Ack=1 Win=235 Len=1448 TSval=1640412654 TSecr=575789884
82,0.000583,203.242.68.95,126.187.209.52,TCP,1466,5058  >  50022 [ACK] Seq=114373 Ack=1 Win=1452 Len=1412
83,0.00059,23.191.254.251,202.235.195.6,TCP,1514,80  >  50820 [ACK] Seq=36201 Ack=1 Win=235 Len=1448 TSval=1640412654 TSecr=575789884
84,0.000592,202.235.195.33,13.148.76.84,TCP,1534,51787  >  443 [ACK] Seq=23137 Ack=1 Win=657 Len=1480
85,0.000597,203.242.85.196,188.5.29.156,ICMP,60,"Echo (ping) request  id=0xef27, seq=4727/30482, ttl=61 (no response found!)"
86,0.000601,23.191.254.251,202.235.195.6,TCP,1514,80  >  50820 [ACK] Seq=37649 Ack=1 Win=235 Len=1448 TSval=1640412654 TSecr=575789884
87,0.000613,203.242.85.196,197.158.34.35,ICMP,60,"Echo (ping) request  id=0xe527, seq=4586/59921, ttl=61 (no response found!)"
88,0.000613,23.191.254.251,202.235.195.6,TCP,1514,80  >  50820 [ACK] Seq=39097 Ack=1 Win=235 Len=1448 TSval=1640412654 TSecr=575789884
89,0.000614,203.242.85.196,187.14.171.193,ICMP,60,"Echo (ping) request  id=0xda27, seq=5247/32532, ttl=61 (no response found!)"
90,0.00062,203.242.68.95,126.187.209.52,TCP,1466,5058  >  50022 [ACK] Seq=115785 Ack=1 Win=1452 Len=1412
91,0.000625,23.191.254.251,202.235.195.6,TCP,1514,80  >  50820 [ACK] Seq=40545 Ack=1 Win=235 Len=1448 TSval=1640412654 TSecr=575789884
92,0.000627,203.242.85.196,170.125.51.43,ICMP,60,"Echo (ping) request  id=0xe527, seq=4586/59921, ttl=61 (no response found!)"
93,0.000629,203.242.85.196,64.194.11.38,ICMP,60,"Echo (ping) request  id=0xda27, seq=5247/32532, ttl=61 (no response found!)"
94,0.000638,23.191.254.251,202.235.195.6,TCP,1514,80  >  50820 [ACK] Seq=41993 Ack=1 Win=235 Len=1448 TSval=1640412654 TSecr=575789884
95,0.000651,23.191.254.251,202.235.195.6,TCP,1514,80  >  50820 [ACK] Seq=43441 Ack=1 Win=235 Len=1448 TSval=1640412654 TSecr=575789884
96,0.000663,23.191.254.251,202.235.195.6,TCP,1514,80  >  50820 [ACK] Seq=44889 Ack=1 Win=235 Len=1448 TSval=1640412654 TSecr=575789884
97,0.000675,23.191.254.251,202.235.195.6,TCP,1514,80  >  50820 [ACK] Seq=46337 Ack=1 Win=235 Len=1448 TSval=1640412654 TSecr=575789884
98,0.000681,203.242.68.95,126.187.209.52,TCP,1466,5058  >  50022 [ACK] Seq=117197 Ack=1 Win=1452 Len=1412
99,0.000681,203.242.85.196,151.96.14.165,ICMP,60,"Echo (ping) request  id=0xe527, seq=4586/59921, ttl=61 (no response found!)"
100,0.000687,23.191.254.251,202.235.195.6,TCP,1514,80  >  50820 [ACK] Seq=47785 Ack=1 Win=235 Len=1448 TSval=1640412654 TSecr=575789884
101,0.000695,203.242.68.95,126.187.209.52,TCP,1466,5058  >  50022 [ACK] Seq=118609 Ack=1 Win=1452 Len=1412
102,0.000695,203.242.85.196,90.246.186.28,ICMP,60,"Echo (ping) request  id=0xda27, seq=5247/32532, ttl=61 (no response found!)"
103,0.0007,23.191.254.251,202.235.195.6,TCP,1514,80  >  50820 [ACK] Seq=49233 Ack=1 Win=235 Len=1448 TSval=1640412654 TSecr=575789884
104,0.000717,203.242.85.196,184.235.225.71,ICMP,60,"Echo (ping) request  id=0xda27, seq=5247/32532, ttl=61 (no response found!)"
105,0.000717,23.191.254.251,202.235.195.6,TCP,1514,80  >  50820 [ACK] Seq=50681 Ack=1 Win=235 Len=1448 TSval=1640412654 TSecr=575789884
106,0.000724,23.191.254.251,202.235.195.6,TCP,1514,80  >  50820 [ACK] Seq=52129 Ack=1 Win=235 Len=1448 TSval=1640412654 TSecr=575789884
107,0.000736,23.191.254.251,202.235.195.6,TCP,1514,80  >  50820 [ACK] Seq=53577 Ack=1 Win=235 Len=1448 TSval=1640412654 TSecr=575789884
108,0.000742,203.242.68.95,126.187.209.52,TCP,1466,5058  >  50022 [ACK] Seq=120021 Ack=1 Win=1452 Len=1412
109,0.000742,203.242.85.196,108.65.253.159,ICMP,60,"Echo (ping) request  id=0xda27, seq=5247/32532, ttl=61 (no response found!)"
110,0.000743,203.242.85.196,104.14.2.163,ICMP,60,"Echo (ping) request  id=0xe527, seq=4586/59921, ttl=61 (no response found!)"
111,0.000749,23.191.254.251,202.235.195.6,TCP,1514,80  >  50820 [ACK] Seq=55025 Ack=1 Win=235 Len=1448 TSval=1640412654 TSecr=575789884
112,0.000756,202.235.195.33,13.148.76.84,TCP,1494,51787  >  443 [ACK] Seq=24617 Ack=43 Win=657 Len=1440
113,0.000757,203.242.85.196,5.217.166.52,ICMP,60,"Echo (ping) request  id=0xda27, seq=5247/32532, ttl=61 (no response found!)"
114,0.000761,23.191.254.251,202.235.195.6,TCP,1514,80  >  50820 [ACK] Seq=56473 Ack=1 Win=235 Len=1448 TSval=1640412654 TSecr=575789884
115,0.00077,202.235.195.33,13.148.76.84,TCP,1494,51787  >  443 [ACK] Seq=26057 Ack=43 Win=657 Len=1440
116,0.000773,23.191.254.251,202.235.195.6,TCP,1514,80  >  50820 [ACK] Seq=57921 Ack=1 Win=235 Len=1448 TSval=1640412654 TSecr=575789884
117,0.000782,202.235.195.33,13.148.76.84,TCP,1494,51787  >  443 [ACK] Seq=27497 Ack=43 Win=657 Len=1440
118,0.000782,203.242.85.196,126.206.170.74,ICMP,60,"Echo (ping) request  id=0xda27, seq=5247/32532, ttl=61 (no response found!)"
119,0.000783,203.242.85.196,126.94.129.94,ICMP,60,"Echo (ping) request  id=0xea27, seq=4585/59665, ttl=61 (reply in 3169)"
120,0.000787,23.191.254.251,202.235.195.6,TCP,1514,80  >  50820 [ACK] Seq=59369 Ack=1 Win=235 Len=1448 TSval=1640412654 TSecr=575789884
121,0.000794,203.242.85.196,75.241.208.57,ICMP,60,"Echo (ping) request  id=0xda27, seq=5247/32532, ttl=61 (no response found!)"
122,0.000795,202.235.195.33,13.148.76.84,TCP,1494,51787  >  443 [ACK] Seq=28937 Ack=43 Win=657 Len=1440
123,0.000798,23.191.254.251,202.235.195.6,TCP,1514,80  >  50820 [ACK] Seq=60817 Ack=1 Win=235 Len=1448 TSval=1640412654 TSecr=575789884
124,0.000811,203.242.85.196,61.67.95.194,ICMP,60,"Echo (ping) request  id=0xda27, seq=5247/32532, ttl=61 (no response found!)"
125,0.000812,23.191.254.251,202.235.195.6,TCP,1514,80  >  50820 [ACK] Seq=62265 Ack=1 Win=235 Len=1448 TSval=1640412654 TSecr=575789884
126,0.000817,202.235.195.33,13.148.76.84,TCP,1494,51787  >  443 [ACK] Seq=30377 Ack=43 Win=657 Len=1440
127,0.000818,203.242.85.196,27.226.210.55,ICMP,60,"Echo (ping) request  id=0xea27, seq=4585/59665, ttl=61 (no response found!)"
128,0.000828,140.252.70.61,203.242.68.70,UDP,176,49898  >  40033 Len=134[Packet size limited during capture]
129,0.000829,45.188.203.163,133.74.28.245,ICMP,60,"Echo (ping) request  id=0x50de, seq=0/0, ttl=49 (no response found!)"
130,0.000829,52.196.107.172,203.242.85.196,ICMP,60,"Echo (ping) reply    id=0xe527, seq=4586/59921, ttl=242"
131,0.000829,195.135.58.188,202.229.73.160,TCP,54,39910  >  81 [SYN] Seq=0 Win=65535 Len=0
132,0.00083,92.248.61.243,150.202.169.161,TCP,54,56691  >  27842 [SYN] Seq=0 Win=1024 Len=0
133,0.00083,17.148.89.180,163.171.243.103,TCP,62,"443  >  58629 [SYN, ACK] Seq=0 Ack=1 Win=29200 Len=0 MSS=1460 WS=32"
134,0.00083,140.201.168.191,203.242.85.196,ICMP,60,"Echo (ping) reply    id=0xdf27, seq=2565/1290, ttl=247"
135,0.000831,3.131.145.67,163.171.1.125,TCP,66,443  >  62026 [ACK] Seq=1 Ack=8245 Win=16375 Len=0 TSval=1631208084 TSecr=851307124
136,0.000831,80.93.73.16,150.202.228.201,TCP,54,41903  >  2559 [SYN] Seq=0 Win=1024 Len=0
137,0.000831,203.242.85.196,171.206.44.13,ICMP,60,"Echo (ping) request  id=0xda27, seq=5247/32532, ttl=61 (no response found!)"
138,0.000832,210.229.141.236,202.235.195.6,TCP,66,443  >  55779 [ACK] Seq=1 Ack=1 Win=1431 Len=0 TSval=2623616791 TSecr=168493041
139,0.000832,203.242.85.196,125.102.125.123,ICMP,60,"Echo (ping) request  id=0xea27, seq=4585/59665, ttl=61 (no response found!)"
140,0.000833,222.101.222.163,203.242.71.179,TCP,130,"27549  >  22 [PSH, ACK] Seq=1 Ack=1 Win=262 Len=64 TSval=3480748 TSecr=3001361191"
141,0.000834,172.163.38.91,202.235.195.6,TCP,66,443  >  46556 [ACK] Seq=1 Ack=1 Win=275 Len=0 TSval=3547169060 TSecr=15451967
142,0.000834,23.191.254.251,202.235.195.6,TCP,1514,"80  >  50820 [PSH, ACK] Seq=63713 Ack=1 Win=235 Len=1448 TSval=1640412654 TSecr=575789884"
143,0.000835,133.89.0.223,203.242.74.144,TCP,66,18872  >  80 [ACK] Seq=1 Ack=1 Win=64397 Len=0 TSval=382646080 TSecr=846867405
144,0.000835,202.235.195.33,13.148.76.84,TCP,1542,51787  >  443 [ACK] Seq=31817 Ack=43 Win=657 Len=1488
145,0.000843,202.235.195.33,13.148.76.84,TCP,1494,51787  >  443 [ACK] Seq=33305 Ack=43 Win=657 Len=1440
146,0.000846,52.65.75.82,202.235.195.6,TCP,1514,443  >  53350 [ACK] Seq=1 Ack=1 Win=208 Len=1448 TSval=2579825241 TSecr=1268195542
147,0.000856,202.235.195.33,13.148.76.84,TCP,1494,51787  >  443 [ACK] Seq=34745 Ack=43 Win=657 Len=1440
148,0.000858,203.242.85.196,178.112.230.32,ICMP,60,"Echo (ping) request  id=0xea27, seq=4585/59665, ttl=61 (no response found!)"
149,0.000859,203.242.85.196,92.254.60.119,ICMP,60,"Echo (ping) request  id=0xda27, seq=5247/32532, ttl=61 (no response found!)"
150,0.00086,52.65.75.82,202.235.195.6,TCP,1514,443  >  53350 [ACK] Seq=1449 Ack=1 Win=208 Len=1448 TSval=2579825241 TSecr=1268195542
151,0.000872,202.235.195.33,13.148.76.84,TCP,1518,51787  >  443 [ACK] Seq=36185 Ack=43 Win=657 Len=1464
152,0.000872,52.65.75.82,202.235.195.6,TCP,1514,443  >  53350 [ACK] Seq=2897 Ack=1 Win=208 Len=1448 TSval=2579825241 TSecr=1268195542
153,0.000885,185.148.48.141,163.171.141.26,TCP,54,51942  >  62610 [SYN] Seq=0 Win=1024 Len=0
154,0.000885,52.65.75.82,202.235.195.6,TCP,1514,443  >  53350 [ACK] Seq=4345 Ack=1 Win=208 Len=1448 TSval=2579825241 TSecr=1268195542
155,0.000886,126.187.209.52,203.242.68.95,TCP,54,50022  >  5058 [ACK] Seq=1 Ack=11297 Win=26723 Len=0
156,0.000899,52.65.75.82,202.235.195.6,TCP,1514,443  >  53350 [ACK] Seq=5793 Ack=1 Win=208 Len=1448 TSval=2579825241 TSecr=1268195542
157,0.0009,203.242.85.196,176.36.172.170,ICMP,60,"Echo (ping) request  id=0xda27, seq=5247/32532, ttl=61 (no response found!)"
158,0.000911,52.65.75.82,202.235.195.6,TCP,1514,443  >  53350 [ACK] Seq=7241 Ack=1 Win=208 Len=1448 TSval=2579825241 TSecr=1268195542
159,0.000917,203.242.85.196,2.123.192.216,ICMP,60,"Echo (ping) request  id=0xda27, seq=5247/32532, ttl=61 (no response found!)"
160,0.000923,52.65.75.82,202.235.195.6,TCP,1514,443  >  53350 [ACK] Seq=8689 Ack=1 Win=208 Len=1448 TSval=2579825241 TSecr=1268195542
161,0.000937,3.131.145.67,163.171.1.125,TCP,66,443  >  62026 [ACK] Seq=1 Ack=17788 Win=16355 Len=0 TSval=1631208084 TSecr=851307124
162,0.000938,52.65.75.82,202.235.195.6,TCP,1514,443  >  53350 [ACK] Seq=10137 Ack=1 Win=208 Len=1448 TSval=2579825241 TSecr=1268195542
163,0.000949,3.139.29.122,203.242.85.196,ICMP,60,"Echo (ping) reply    id=0xe527, seq=4586/59921, ttl=48"
164,0.00095,108.68.44.76,203.242.85.196,ICMP,74,Destination unreachable (Host unreachable)
165,0.000951,52.65.75.82,202.235.195.6,TCP,1514,443  >  53350 [ACK] Seq=11585 Ack=1 Win=208 Len=1448 TSval=2579825241 TSecr=1268195542
166,0.000962,52.65.75.82,202.235.195.6,TCP,1514,443  >  53350 [ACK] Seq=13033 Ack=1 Win=208 Len=1448 TSval=2579825241 TSecr=1268195542
167,0.000963,154.198.223.26,203.242.85.196,ICMP,110,Time-to-live exceeded (Time to live exceeded in transit)
168,0.000976,74.116.91.74,202.235.195.6,TCP,1462,443  >  54764 [ACK] Seq=1 Ack=1 Win=1049 Len=1396 TSval=1508702547 TSecr=1431355544
169,0.000986,74.116.91.74,202.235.195.6,TCP,1462,443  >  54764 [ACK] Seq=1397 Ack=1 Win=1049 Len=1396 TSval=1508702547 TSecr=1431355544
170,0.000999,52.65.75.82,202.235.195.6,TCP,1514,443  >  53350 [ACK] Seq=14481 Ack=1 Win=208 Len=1448 TSval=2579825241 TSecr=1268195542
171,0.001016,52.65.75.82,202.235.195.6,TCP,1514,443  >  53350 [ACK] Seq=15929 Ack=1 Win=208 Len=1448 TSval=2579825241 TSecr=1268195542
172,0.001017,8.200.117.164,202.235.195.6,TCP,565,"853  >  41754 [PSH, ACK] Seq=1 Ack=1 Win=705 Len=499 TSval=522631400 TSecr=202780"
173,0.001029,52.65.75.82,202.235.195.6,TCP,1514,443  >  53350 [ACK] Seq=17377 Ack=1 Win=208 Len=1448 TSval=2579825242 TSecr=1268195542
174,0.00104,202.235.195.33,13.148.76.84,TCP,1494,51787  >  443 [ACK] Seq=37649 Ack=43 Win=657 Len=1440
175,0.001042,52.65.75.82,202.235.195.6,TCP,1514,443  >  53350 [ACK] Seq=18825 Ack=1 Win=208 Len=1448 TSval=2579825242 TSecr=1268195542
176,0.001052,173.66.45.212,202.235.195.6,TCP,1462,443  >  55429 [ACK] Seq=2793 Ack=1 Win=398 Len=1396 TSval=1372761025 TSecr=877514879
177,0.001055,202.235.195.33,13.148.76.84,TCP,1494,51787  >  443 [ACK] Seq=39089 Ack=43 Win=657 Len=1440
178,0.001064,173.66.45.212,202.235.195.6,TCP,1462,443  >  55429 [ACK] Seq=4189 Ack=1 Win=398 Len=1396 TSval=1372761025 TSecr=877514879
179,0.001068,202.235.195.33,13.148.76.84,TCP,1494,51787  >  443 [ACK] Seq=40529 Ack=43 Win=657 Len=1440
180,0.001077,52.65.75.82,202.235.195.6,TCP,1514,443  >  53350 [ACK] Seq=20273 Ack=1 Win=208 Len=1448 TSval=2579825242 TSecr=1268195542
181,0.00108,202.235.195.33,13.148.76.84,TCP,1526,51787  >  443 [ACK] Seq=41969 Ack=43 Win=657 Len=1472
182,0.001083,52.65.75.82,202.235.195.6,TCP,701,"443  >  53350 [PSH, ACK] Seq=21721 Ack=1 Win=208 Len=635 TSval=2579825242 TSecr=1268195542"
183,0.001101,23.191.255.233,202.235.195.144,TCP,1514,443  >  61038 [ACK] Seq=4345 Ack=1 Win=1392 Len=1448 TSval=1581989534 TSecr=4214194534
184,0.001108,23.191.255.233,202.235.195.144,TCP,1514,443  >  61038 [ACK] Seq=5793 Ack=1 Win=1392 Len=1448 TSval=1581989534 TSecr=4214194534
185,0.00112,204.210.45.27,203.242.74.73,IPv4,90,[Packet size limited during capture]
186,0.00112,3.131.145.67,163.171.1.125,TCP,66,443  >  62026 [ACK] Seq=1 Ack=20536 Win=16375 Len=0 TSval=1631208084 TSecr=851307124
187,0.001121,23.191.255.233,202.235.195.144,TCP,1514,443  >  61038 [ACK] Seq=7241 Ack=1 Win=1392 Len=1448 TSval=1581989534 TSecr=4214194534
188,0.001145,60.181.32.144,203.242.66.199,TCP,1468,63875  >  35089 [ACK] Seq=5657 Ack=1 Win=1025 Len=1414
189,0.001169,60.181.32.144,203.242.66.199,TCP,1468,63875  >  35089 [ACK] Seq=7071 Ack=1 Win=1025 Len=1414
190,0.001171,203.242.74.73,204.210.45.27,IPv4,98,[Packet size limited during capture]
191,0.001181,60.181.32.144,203.242.66.199,TCP,1468,63875  >  35089 [ACK] Seq=8485 Ack=1 Win=1025 Len=1414
192,0.001192,162.124.191.190,163.171.1.188,TCP,1354,443  >  50364 [ACK] Seq=1 Ack=1 Win=27 Len=1288 TSval=2208127589 TSecr=961156344
193,0.001203,162.124.191.190,163.171.1.188,TCP,1354,443  >  50364 [ACK] Seq=1289 Ack=1 Win=27 Len=1288 TSval=2208127589 TSecr=961156344
194,0.00122,60.181.32.144,203.242.66.199,TCP,1468,63875  >  35089 [ACK] Seq=9899 Ack=1 Win=1025 Len=1414
195,0.001227,60.181.32.144,203.242.66.199,TCP,1468,"63875  >  35089 [PSH, ACK] Seq=11313 Ack=1 Win=1025 Len=1414"
196,0.001234,157.100.57.204,163.171.250.84,TCP,54,32767  >  8545 [SYN] Seq=0 Win=1024 Len=0
197,0.001235,162.124.191.190,163.171.1.188,TCP,1118,"443  >  50364 [PSH, ACK] Seq=2577 Ack=1 Win=27 Len=1052 TSval=2208127589 TSecr=961156344"
198,0.001235,216.111.105.221,203.242.85.196,ICMP,60,"Echo (ping) reply    id=0xda27, seq=334/19969, ttl=247"
199,0.001237,202.235.195.6,198.57.236.137,TCP,66,63787  >  443 [ACK] Seq=1 Ack=1 Win=2647 Len=0 TSval=972385707 TSecr=671237867
200,0.001253,202.235.195.6,198.57.236.137,TCP,66,63787  >  443 [ACK] Seq=1 Ack=2897 Win=2647 Len=0 TSval=972385707 TSecr=671237868
201,0.001261,23.7.149.251,202.235.195.6,TCP,1514,443  >  49326 [ACK] Seq=2897 Ack=1 Win=243 Len=1448 TSval=719591752 TSecr=658895002
202,0.001269,202.235.195.6,198.57.236.137,TCP,66,63787  >  443 [ACK] Seq=1 Ack=4345 Win=2669 Len=0 TSval=972385708 TSecr=671237868
203,0.001274,23.7.149.251,202.235.195.6,TCP,1514,443  >  49326 [ACK] Seq=4345 Ack=1 Win=243 Len=1448 TSval=719591752 TSecr=658895002
204,0.001304,126.187.209.52,203.242.68.95,TCP,54,50022  >  5058 [ACK] Seq=1 Ack=16945 Win=26723 Len=0
205,0.001336,3.131.145.67,163.171.1.125,TCP,66,443  >  62026 [ACK] Seq=1 Ack=30079 Win=16351 Len=0 TSval=1631208084 TSecr=851307124
206,0.001398,203.242.66.199,60.181.32.144,TCP,54,35089  >  63875 [ACK] Seq=1 Ack=7071 Win=15308 Len=0
207,0.001402,45.180.171.170,150.202.27.69,TCP,54,54959  >  42730 [SYN] Seq=0 Win=1024 Len=0
208,0.001408,2001:7e7d:6f9:4a0c:39ce:ff4a:fec3:9fb3,2001:7be4:ce9e:400f:9631:6070:fe0b:9f80,DNS,104,Standard query 0xeb28[Packet size limited during capture]
209,0.001418,217.94.171.186,203.242.85.196,ICMP,60,"Echo (ping) reply    id=0xef27, seq=1751/55046, ttl=56"
210,0.00142,138.35.84.0,203.242.85.196,ICMP,74,Time-to-live exceeded (Time to live exceeded in transit)
211,0.001437,203.242.66.199,60.181.32.144,TCP,54,35089  >  63875 [ACK] Seq=1 Ack=9899 Win=15308 Len=0
212,0.001438,70.220.177.250,203.242.68.75,TCP,66,54848  >  80 [ACK] Seq=1 Ack=4294797377 Win=21914 Len=0 TSval=1344496335 TSecr=2173659836
213,0.001464,185.148.48.141,202.229.109.127,TCP,54,51942  >  54230 [SYN] Seq=0 Win=1024 Len=0
214,0.001471,203.242.68.95,126.187.209.52,TCP,1466,5058  >  50022 [ACK] Seq=121433 Ack=1 Win=1452 Len=1412
215,0.001478,200.255.73.186,203.242.85.196,ICMP,60,"Echo (ping) reply    id=0xda27, seq=1277/64772, ttl=240"
216,0.001496,202.229.94.149,190.165.200.222,TCP,130,"60042  >  22 [PSH, ACK] Seq=1 Ack=1 Win=262 Len=64 TSval=2109278887 TSecr=568251620"
217,0.001496,203.242.68.95,126.187.209.52,TCP,1466,5058  >  50022 [ACK] Seq=122845 Ack=1 Win=1452 Len=1412
218,0.001496,98.154.158.75,203.242.85.196,ICMP,60,"Echo (ping) reply    id=0xda27, seq=1391/28421, ttl=43"
219,0.001511,203.242.85.196,2.139.124.46,ICMP,60,"Echo (ping) request  id=0xef27, seq=4727/30482, ttl=61 (no response found!)"
220,0.001512,203.242.66.199,60.181.32.144,TCP,54,35089  >  63875 [ACK] Seq=1 Ack=12727 Win=15308 Len=0
221,0.001516,203.242.85.196,86.53.136.80,ICMP,60,"Echo (ping) request  id=0xda27, seq=5247/32532, ttl=61 (no response found!)"
222,0.001517,172.163.36.17,202.235.195.6,TCP,54,443  >  61490 [ACK] Seq=1 Ack=1 Win=15249 Len=0
223,0.001528,203.242.68.95,126.187.209.52,TCP,1466,5058  >  50022 [ACK] Seq=124257 Ack=1 Win=1452 Len=1412
224,0.001528,203.242.64.23,162.124.191.190,TCP,66,3519  >  443 [ACK] Seq=1 Ack=1 Win=2044 Len=0 TSval=326662743 TSecr=1660176241
225,0.001529,163.171.37.112,91.84.220.85,TCP,54,50334  >  80 [ACK] Seq=1 Ack=1 Win=64240 Len=0
226,0.001529,203.242.74.73,204.210.45.27,IPv4,90,[Packet size limited during capture]
227,0.001532,203.242.85.196,39.65.206.123,ICMP,60,"Echo (ping) request  id=0xef27, seq=4727/30482, ttl=61 (no response found!)"
228,0.001535,3.131.145.67,163.171.1.125,TCP,66,443  >  62026 [ACK] Seq=1 Ack=32827 Win=16375 Len=0 TSval=1631208085 TSecr=851307124
229,0.001566,203.242.85.196,94.58.87.206,ICMP,60,"Echo (ping) request  id=0xda27, seq=5247/32532, ttl=61 (no response found!)"
230,0.001567,203.242.85.196,78.96.52.106,ICMP,60,"Echo (ping) request  id=0xda27, seq=5247/32532, ttl=61 (no response found!)"
231,0.001567,13.143.41.57,163.171.130.77,TCP,123,"443  >  51662 [PSH, ACK] Seq=1 Ack=1 Win=9 Len=57 TSval=1613611463 TSecr=1964277083"
232,0.001567,203.242.85.196,68.252.109.23,ICMP,60,"Echo (ping) request  id=0xea27, seq=4585/59665, ttl=61 (no response found!)"
233,0.001568,203.242.68.95,126.187.209.52,TCP,1466,5058  >  50022 [ACK] Seq=125669 Ack=1 Win=1452 Len=1412
234,0.001591,64.110.122.92,202.235.195.6,TCP,66,443  >  53674 [ACK] Seq=1 Ack=1 Win=3185 Len=0 TSval=2220764954 TSecr=973961719
235,0.001608,203.242.68.95,126.187.209.52,TCP,1466,5058  >  50022 [ACK] Seq=127081 Ack=1 Win=1452 Len=1412
236,0.001609,203.242.85.196,206.109.57.85,ICMP,60,"Echo (ping) request  id=0xda27, seq=5247/32532, ttl=61 (no response found!)"
237,0.001609,79.192.226.130,203.242.85.196,ICMP,60,"Echo (ping) reply    id=0xea27, seq=820/13315, ttl=56"
238,0.00161,203.242.71.179,222.101.222.163,TCP,78,22  >  27549 [ACK] Seq=65 Ack=65 Win=240 Len=0 TSval=3001361628 TSecr=3480748 SLE=1 SRE=65
239,0.001611,203.242.85.196,84.196.141.54,ICMP,60,"Echo (ping) request  id=0xda27, seq=3419/23309, ttl=61 (no response found!)"
240,0.001635,203.242.68.95,126.187.209.52,TCP,1466,5058  >  50022 [ACK] Seq=128493 Ack=1 Win=1452 Len=1412
241,0.001635,203.242.85.196,201.118.198.119,ICMP,60,"Echo (ping) request  id=0xda27, seq=5247/32532, ttl=61 (no response found!)"
242,0.001635,203.242.85.196,72.167.105.124,ICMP,60,"Echo (ping) request  id=0xea27, seq=4585/59665, ttl=61 (no response found!)"
243,0.001636,203.242.85.196,83.75.250.234,ICMP,60,"Echo (ping) request  id=0xea27, seq=3631/12046, ttl=61 (no response found!)"
244,0.00165,45.180.171.170,163.171.31.178,TCP,54,54959  >  42729 [SYN] Seq=0 Win=1024 Len=0
245,0.001673,203.242.85.196,106.5.13.198,ICMP,60,"Echo (ping) request  id=0xda27, seq=1765/58630, ttl=61 (no response found!)"
246,0.001673,203.242.85.196,116.220.241.125,ICMP,60,"Echo (ping) request  id=0xda27, seq=4600/63505, ttl=61 (no response found!)"
247,0.001677,3.131.145.67,163.171.1.125,TCP,66,443  >  62026 [ACK] Seq=1 Ack=35575 Win=16375 Len=0 TSval=1631208085 TSecr=851307124
248,0.00168,203.242.68.95,126.187.209.52,TCP,1466,5058  >  50022 [ACK] Seq=129905 Ack=1 Win=1452 Len=1412
249,0.001705,203.242.68.95,126.187.209.52,TCP,1466,5058  >  50022 [ACK] Seq=131317 Ack=1 Win=1452 Len=1412
250,0.001706,203.242.85.196,2.8.242.154,ICMP,60,"Echo (ping) request  id=0xda27, seq=5247/32532, ttl=61 (no response found!)"
251,0.001709,203.242.85.196,181.57.54.69,ICMP,60,"Echo (ping) request  id=0xda27, seq=5247/32532, ttl=61 (no response found!)"
252,0.001709,203.242.85.196,90.245.13.203,ICMP,60,"Echo (ping) request  id=0xda27, seq=3132/15372, ttl=61 (no response found!)"
253,0.001714,23.7.149.73,202.235.195.6,TCP,1514,80  >  51188 [ACK] Seq=1 Ack=1 Win=1392 Len=1460
254,0.001726,23.7.149.73,202.235.195.6,TCP,1514,80  >  51188 [ACK] Seq=1461 Ack=1 Win=1392 Len=1460
255,0.001732,203.242.68.95,126.187.209.52,TCP,1466,5058  >  50022 [ACK] Seq=132729 Ack=1 Win=1452 Len=1412
256,0.001737,203.242.85.196,186.90.253.149,ICMP,60,"Echo (ping) request  id=0xda27, seq=3248/45068, ttl=61 (no response found!)"
257,0.001737,60.181.32.144,203.242.66.199,TCP,1468,63875  >  35089 [ACK] Seq=12727 Ack=1 Win=1025 Len=1414
258,0.001756,173.66.45.159,202.235.195.6,TCP,1462,443  >  50029 [ACK] Seq=1 Ack=1 Win=365 Len=1396 TSval=4206644626 TSecr=210041043
259,0.001762,173.66.45.159,202.235.195.6,TCP,1462,443  >  50029 [ACK] Seq=1397 Ack=1 Win=365 Len=1396 TSval=4206644626 TSecr=210041043
260,0.001772,203.242.68.95,126.187.209.52,TCP,1466,5058  >  50022 [ACK] Seq=134141 Ack=1 Win=1452 Len=1412
261,0.001772,203.242.85.196,179.207.166.244,ICMP,60,"Echo (ping) request  id=0xda27, seq=5247/32532, ttl=61 (no response found!)"
262,0.001772,203.242.85.196,58.0.243.169,ICMP,60,"Echo (ping) request  id=0xda27, seq=5247/32532, ttl=61 (no response found!)"
263,0.001774,60.181.32.144,203.242.66.199,TCP,1468,63875  >  35089 [ACK] Seq=14141 Ack=1 Win=1025 Len=1414
264,0.001785,60.181.32.144,203.242.66.199,TCP,1468,63875  >  35089 [ACK] Seq=15555 Ack=1 Win=1025 Len=1414
265,0.001792,203.242.85.196,75.236.97.4,ICMP,60,"Echo (ping) request  id=0xda27, seq=5247/32532, ttl=61 (no response found!)"
266,0.001797,60.181.32.144,203.242.66.199,TCP,1468,63875  >  35089 [ACK] Seq=16969 Ack=1 Win=1025 Len=1414
267,0.001814,60.181.32.144,203.242.66.199,TCP,1468,63875  >  35089 [ACK] Seq=18383 Ack=1 Win=1025 Len=1414
268,0.001822,167.184.156.10,133.251.166.246,TCP,74,44783  >  23 [SYN] Seq=0 Win=14600 Len=0 MSS=1460 SACK_PERM TSval=9366100 TSecr=0 WS=128
269,0.001822,60.181.32.144,203.242.66.199,TCP,1468,63875  >  35089 [ACK] Seq=19797 Ack=1 Win=1025 Len=1414
270,0.001839,41.223.210.148,163.171.183.181,TCP,54,48460  >  23 [SYN] Seq=0 Win=39276 Len=0
271,0.00184,60.181.32.144,203.242.66.199,TCP,1468,63875  >  35089 [ACK] Seq=21211 Ack=1 Win=1025 Len=1414
272,0.001841,32.164.172.222,203.242.85.196,ICMP,60,"Echo (ping) reply    id=0xef27, seq=4727/30482, ttl=48"
273,0.001841,64.110.122.92,202.235.195.6,TCP,66,443  >  53674 [ACK] Seq=1 Ack=2377 Win=3185 Len=0 TSval=2220764954 TSecr=973961719
274,0.001847,173.66.45.212,202.235.195.6,TCP,1462,443  >  55429 [ACK] Seq=5585 Ack=1 Win=398 Len=1396 TSval=1372761026 TSecr=877514882
275,0.001859,60.181.32.144,203.242.66.199,TCP,1468,63875  >  35089 [ACK] Seq=22625 Ack=1 Win=1025 Len=1414
276,0.00186,163.171.119.5,40.81.122.103,TCP,129,"56421  >  443 [PSH, ACK] Seq=1 Ack=1 Win=1026 Len=75"
277,0.001877,222.171.87.207,203.242.85.196,ICMP,60,"Echo (ping) reply    id=0xdf27, seq=2982/42507, ttl=245"
278,0.001877,173.66.45.212,202.235.195.6,TCP,1462,443  >  55429 [ACK] Seq=6981 Ack=1 Win=398 Len=1396 TSval=1372761026 TSecr=877514882
279,0.001877,203.242.85.196,197.248.55.112,ICMP,60,"Echo (ping) request  id=0xdf27, seq=4476/31761, ttl=61 (no response found!)"
280,0.001879,203.242.85.196,172.79.91.51,ICMP,60,"Echo (ping) request  id=0xef27, seq=4727/30482, ttl=61 (no response found!)"
281,0.001884,60.181.32.144,203.242.66.199,TCP,1468,"63875  >  35089 [PSH, ACK] Seq=24039 Ack=1 Win=1025 Len=1414"
282,0.001885,185.190.216.46,150.202.207.40,TCP,54,54319  >  2789 [SYN] Seq=0 Win=1024 Len=0
283,0.001897,60.181.32.144,203.242.66.199,TCP,1468,63875  >  35089 [ACK] Seq=25453 Ack=1 Win=1025 Len=1414
284,0.001914,60.181.32.144,203.242.66.199,TCP,1468,63875  >  35089 [ACK] Seq=26867 Ack=1 Win=1025 Len=1414
285,0.001914,126.187.209.52,203.242.68.95,TCP,54,50022  >  5058 [ACK] Seq=1 Ack=19769 Win=26723 Len=0
286,0.001922,60.181.32.144,203.242.66.199,TCP,1468,63875  >  35089 [ACK] Seq=28281 Ack=1 Win=1025 Len=1414
287,0.001922,203.242.85.196,184.225.55.170,ICMP,60,"Echo (ping) request  id=0xdf27, seq=706/49666, ttl=61 (no response found!)"
288,0.001923,3.131.145.67,163.171.1.125,TCP,66,443  >  62026 [ACK] Seq=1 Ack=41071 Win=16375 Len=0 TSval=1631208085 TSecr=851307124
289,0.001934,60.181.32.144,203.242.66.199,TCP,1468,63875  >  35089 [ACK] Seq=29695 Ack=1 Win=1025 Len=1414
290,0.001946,203.242.74.144,60.79.71.138,TCP,1474,80  >  50410 [ACK] Seq=1 Ack=1 Win=64064 Len=1408 TSval=846867405 TSecr=724802981
291,0.001946,126.187.209.52,203.242.68.95,TCP,54,50022  >  5058 [ACK] Seq=1 Ack=22593 Win=26723 Len=0
292,0.001947,203.242.73.157,222.101.222.163,TCP,129,"22  >  64954 [PSH, ACK] Seq=1 Ack=1 Win=4197 Len=63 TSval=3 TSecr=3480733"
293,0.001948,60.181.32.144,203.242.66.199,TCP,1468,63875  >  35089 [ACK] Seq=31109 Ack=1 Win=1025 Len=1414
294,0.001951,203.242.85.196,36.140.213.79,ICMP,60,"Echo (ping) request  id=0xef27, seq=4727/30482, ttl=61 (no response found!)"
295,0.001953,203.242.74.144,60.79.71.138,TCP,1474,"80  >  50410 [PSH, ACK] Seq=1409 Ack=1 Win=64064 Len=1408 TSval=846867405 TSecr=724802981"
296,0.001959,60.181.32.144,203.242.66.199,TCP,1468,63875  >  35089 [ACK] Seq=32523 Ack=1 Win=1025 Len=1414
297,0.001959,45.180.169.125,202.235.197.75,TCP,66,"43132  >  22 [SYN, ECE, CWR] Seq=0 Win=8192 Len=0 MSS=1460 WS=256 SACK_PERM"
298,0.001968,203.242.74.144,60.79.71.138,TCP,1474,"80  >  50410 [PSH, ACK] Seq=2817 Ack=1 Win=64064 Len=1408 TSval=846867405 TSecr=724802981"
299,0.001971,60.181.32.144,203.242.66.199,TCP,1468,63875  >  35089 [ACK] Seq=33937 Ack=1 Win=1025 Len=1414
300,0.001973,203.242.85.196,190.40.161.106,ICMP,60,"Echo (ping) request  id=0xda27, seq=5247/32532, ttl=61 (no response found!)"
301,0.001974,203.242.74.144,60.79.71.138,TCP,1474,"80  >  50410 [PSH, ACK] Seq=4225 Ack=1 Win=64064 Len=1408 TSval=846867405 TSecr=724802981"
302,0.001979,203.242.74.144,60.79.71.138,TCP,1474,"80  >  50410 [PSH, ACK] Seq=5633 Ack=1 Win=64064 Len=1408 TSval=846867405 TSecr=724802981"
303,0.001982,203.242.85.196,177.162.26.142,ICMP,60,"Echo (ping) request  id=0xef27, seq=4727/30482, ttl=61 (no response found!)"
304,0.001983,60.181.32.144,203.242.66.199,TCP,1468,63875  >  35089 [ACK] Seq=35351 Ack=1 Win=1025 Len=1414
305,0.001983,203.242.74.144,60.79.71.138,TCP,1474,"80  >  50410 [PSH, ACK] Seq=7041 Ack=1 Win=64064 Len=1408 TSval=846867405 TSecr=724802981"
306,0.001988,203.242.74.144,60.79.71.138,TCP,1474,"80  >  50410 [PSH, ACK] Seq=8449 Ack=1 Win=64064 Len=1408 TSval=846867405 TSecr=724802981"
307,0.001996,240e:bd07:336f:1f4:6001:803c:8180:1ffd,2001:7e7d:6f9:93d0:3e3f:8f8c:8e88:c115,TCP,78,38699  >  10443 [SYN] Seq=0 Win=29200 Len=0 MSS=1460
308,0.001997,36.118.56.5,203.242.22.175,TCP,54,1840  >  23 [SYN] Seq=0 Win=10004 Len=0
309,0.001997,60.181.32.144,203.242.66.199,TCP,1468,63875  >  35089 [ACK] Seq=36765 Ack=1 Win=1025 Len=1414
310,0.001999,203.242.85.196,68.121.151.15,ICMP,60,"Echo (ping) request  id=0xdf27, seq=1380/25605, ttl=61 (no response found!)"
311,0.002009,60.181.32.144,203.242.66.199,TCP,1468,63875  >  35089 [ACK] Seq=38179 Ack=1 Win=1025 Len=1414
312,0.00201,203.242.85.196,124.225.35.211,ICMP,60,"Echo (ping) request  id=0xef27, seq=4727/30482, ttl=61 (no response found!)"
313,0.002021,60.181.32.144,203.242.66.199,TCP,1468,"63875  >  35089 [PSH, ACK] Seq=39593 Ack=1 Win=1025 Len=1414"
314,0.002024,203.242.85.196,186.84.51.159,ICMP,60,"Echo (ping) request  id=0xda27, seq=5247/32532, ttl=61 (no response found!)"
315,0.002029,203.242.64.23,162.124.191.190,TCP,587,"3519  >  443 [PSH, ACK] Seq=1 Ack=1 Win=2048 Len=521 TSval=326662745 TSecr=1660176241"
316,0.002032,60.181.32.144,203.242.66.199,TCP,1468,63875  >  35089 [ACK] Seq=41007 Ack=1 Win=1025 Len=1414
317,0.002033,3.131.145.67,163.171.1.125,TCP,66,443  >  62026 [ACK] Seq=1 Ack=43819 Win=16375 Len=0 TSval=1631208085 TSecr=851307124
318,0.002035,13.141.5.50,202.235.195.6,TCP,154,"20047  >  55031 [PSH, ACK] Seq=1 Ack=1 Win=141 Len=88 TSval=1553681837 TSecr=997146497"
319,0.002037,203.242.85.196,176.38.199.2,ICMP,60,"Echo (ping) request  id=0xdf27, seq=4476/31761, ttl=61 (no response found!)"
320,0.002039,203.242.66.199,60.181.32.144,TCP,54,35089  >  63875 [ACK] Seq=1 Ack=21211 Win=15308 Len=0
321,0.002047,202.235.195.6,198.57.236.137,TCP,66,63787  >  443 [ACK] Seq=1 Ack=7241 Win=2647 Len=0 TSval=972385708 TSecr=671237868
322,0.002047,23.7.149.73,202.235.195.6,TCP,1514,80  >  51192 [ACK] Seq=1 Ack=1 Win=1392 Len=1460
323,0.002056,202.235.195.6,198.57.236.137,TCP,66,[TCP Window Update] 63787  >  443 [ACK] Seq=1 Ack=7241 Win=2669 Len=0 TSval=972385708 TSecr=671237868
324,0.002057,203.242.74.144,60.79.71.138,TCP,1474,"80  >  50410 [PSH, ACK] Seq=9857 Ack=1 Win=64064 Len=1408 TSval=846867405 TSecr=724802981"
325,0.002059,23.7.149.73,202.235.195.6,TCP,1514,80  >  51192 [ACK] Seq=1461 Ack=1 Win=1392 Len=1460
326,0.00206,203.242.85.196,52.214.247.99,ICMP,60,"Echo (ping) request  id=0xdf27, seq=1670/34310, ttl=61 (no response found!)"
327,0.002073,60.181.32.144,203.242.66.199,TCP,1468,63875  >  35089 [ACK] Seq=42421 Ack=1 Win=1025 Len=1414
328,0.002073,3.131.145.67,163.171.1.125,TCP,66,443  >  62026 [ACK] Seq=1 Ack=46492 Win=16375 Len=0 TSval=1631208085 TSecr=851307124
